{
  "schema_version": "1.0.0",
  "app_id": "budget-beacon-019e884e",
  "app_slug": "budget-beacon",
  "app_uuid": "019e884e-b106-7531-80de-f01b3c8f56db",
  "app_name": "Budget Beacon",
  "repo_root": "/home/whyte/.MyAppZ/BudgetBeacon",
  "repo_root_realpath": "/home/whyte/.MyAppZ/BudgetBeacon",
  "host_fingerprint_id": "fp_000000000000",
  "aiast_install_id": "unknown",
  "aiast_template_version": "1.24.0",
  "created_at": "2026-06-02T12:28:39Z",
  "created_by": "whyte@gh0stz",
  "allowed_repo_root": "/home/whyte/.MyAppZ/BudgetBeacon",
  "forbidden_roots": [
    "/home/whyte/.MyAppZ/_AI_AGENT_SYSTEM_TEMPLATE",
    "/home/whyte/.MyAppZ/.cursor",
    "/home/whyte/.MyAppZ/AegisSwarm",
    "/home/whyte/.MyAppZ/AegisWire",
    "/home/whyte/.MyAppZ/Agent-AppZ-Savige",
    "/home/whyte/.MyAppZ/AgentInits",
    "/home/whyte/.MyAppZ/AgentZero",
    "/home/whyte/.MyAppZ/AppScope",
    "/home/whyte/.MyAppZ/AwayMode",
    "/home/whyte/.MyAppZ/BlueWraith",
    "/home/whyte/.MyAppZ/CandleCompass",
    "/home/whyte/.MyAppZ/CleanoutConnect",
    "/home/whyte/.MyAppZ/CleanoutConnect-44",
    "/home/whyte/.MyAppZ/CodeSeal",
    "/home/whyte/.MyAppZ/ContextCore",
    "/home/whyte/.MyAppZ/CouplesWealth",
    "/home/whyte/.MyAppZ/DeepWeave",
    "/home/whyte/.MyAppZ/EtherTrain",
    "/home/whyte/.MyAppZ/EtherWeave",
    "/home/whyte/.MyAppZ/FlipHole",
    "/home/whyte/.MyAppZ/ForciteZ",
    "/home/whyte/.MyAppZ/ForgeCouncil",
    "/home/whyte/.MyAppZ/Friction",
    "/home/whyte/.MyAppZ/GhostGrid",
    "/home/whyte/.MyAppZ/GurdianIntel",
    "/home/whyte/.MyAppZ/HQIQ",
    "/home/whyte/.MyAppZ/HardModeHealth",
    "/home/whyte/.MyAppZ/IdeaForge",
    "/home/whyte/.MyAppZ/Immortality",
    "/home/whyte/.MyAppZ/LeashLine",
    "/home/whyte/.MyAppZ/LedgerLoop",
    "/home/whyte/.MyAppZ/LuxeLogic",
    "/home/whyte/.MyAppZ/Malwrath",
    "/home/whyte/.MyAppZ/MetaCommander",
    "/home/whyte/.MyAppZ/MetaScope",
    "/home/whyte/.MyAppZ/ModPilot",
    "/home/whyte/.MyAppZ/NeuroNest",
    "/home/whyte/.MyAppZ/OmniForgeNexus",
    "/home/whyte/.MyAppZ/Orignym",
    "/home/whyte/.MyAppZ/PalmOracle",
    "/home/whyte/.MyAppZ/PharmPhreak",
    "/home/whyte/.MyAppZ/PromptMage",
    "/home/whyte/.MyAppZ/QuantumReaper",
    "/home/whyte/.MyAppZ/SavigeAI",
    "/home/whyte/.MyAppZ/SavigeSystemZ.com",
    "/home/whyte/.MyAppZ/SecuritySentinel",
    "/home/whyte/.MyAppZ/ShadowCall",
    "/home/whyte/.MyAppZ/SiliconLedger",
    "/home/whyte/.MyAppZ/Sipher",
    "/home/whyte/.MyAppZ/SteadyStack",
    "/home/whyte/.MyAppZ/TechpulseBriefs",
    "/home/whyte/.MyAppZ/TheEcleticExchange",
    "/home/whyte/.MyAppZ/TraceForge",
    "/home/whyte/.MyAppZ/VADO",
    "/home/whyte/.MyAppZ/Veritas",
    "/home/whyte/.MyAppZ/Vetraxis",
    "/home/whyte/.MyAppZ/VulnFlow",
    "/home/whyte/.MyAppZ/WRAITHS",
    "/home/whyte/.MyAppZ/WebGhostZ",
    "/home/whyte/.MyAppZ/WisdomWarp",
    "/home/whyte/.MyAppZ/WraithsCast",
    "/home/whyte/.MyAppZ/_AIAST_STRESS_TESTS",
    "/home/whyte/.MyAppZ/_AIAST_TEST_APPS",
    "/home/whyte/.MyAppZ/_AIAST_TEST_APPS_V3",
    "/home/whyte/.MyAppZ/_AI_AGENT_SYSTEM_TESTS",
    "/home/whyte/.MyAppZ/_HERETIC_META_SYSTEM_ENHANCMENTS",
    "/home/whyte/.MyAppZ/_TEST_ISOLATION_E2E",
    "/home/whyte/.MyAppZ/_backups",
    "/home/whyte/.MyAppZ/containers",
    "/home/whyte/.MyAppZ/runs"
  ],
  "namespaces": {
    "mcp": "budget-beacon-019e884e:mcp",
    "agents": "budget-beacon-019e884e:agents",
    "tool_memory": "budget-beacon-019e884e:tool-memory",
    "ports": "budget-beacon-019e884e:ports",
    "db": "budget_beacon_019e884e_",
    "cache_keys": "budget-beacon-019e884e:",
    "browser_profile_dir": "/home/whyte/.MyAppZ/BudgetBeacon/.local/browser-profiles/budget-beacon-019e884e"
  },
  "lifecycle": {
    "immutable_fields": [
      "app_uuid",
      "app_id",
      "created_at"
    ],
    "rename_allowed_fields": [
      "app_name",
      "app_slug"
    ],
    "reset_requires": "explicit-operator-flag",
    "events": [
      {
        "ts": "2026-06-02T12:28:39Z",
        "kind": "created",
        "details": {
          "by": "init-app-namespace.sh",
          "template_version": "1.24.0"
        }
      }
    ]
  }
}
